,id,name,release_date,description,duration_ms,url
0,6rOGcz6IVa1uBBzln6ubxm,Con el pelado de El Transportador,2023-10-06,"Se estrenó una nueva de la saga Saw y se hizo lo que había que hacer. Calu y Flor no sólo hablan de El Juego del Miedo X (2023), también tratan de ¿rankear? ¿analizar? ¿distinguir? ¿ordenar? todas las películas de este universo creado por James Wan y Leigh Whannell.  Se discuten también cuestiones vinculadas con Glen Danzig y la política de los cines con respecto a hablar en medio de una función, la película seleccionada para representar a Argentina en los Oscar y Mean Girls en Tik Tok.   🐐 Si querés escuchar más podés suscribirte a la versión paga en hoytrasnoche.com 🐐",4922044,https://open.spotify.com/episode/6rOGcz6IVa1uBBzln6ubxm
1,4y53XuXDwBfrnMdDNTzX7E,118: Si yo voy a ver esta película vos también,2023-09-29,"Una vez más Calu (Santiago Calori) y Flor (Fio Sargenti) reciben al Negro Martí. Nos ponemos de pie, aplaudimos y agradecemos.  El tema es que vieron Los Indestructibles 4 (Expend4bles, 2023). Y bueno, viejo, todo no se puede. Ah, y se terminó la huelga de guionistas así que tratamos de repasar algunos de los puntos más importantes, además de comentar varias de las cosas que viene diciendo Martin Scorsese en los últimos días.   🐐 Si esto te gusta podés pasar por hoytrasnoche.com 🐐",4855301,https://open.spotify.com/episode/4y53XuXDwBfrnMdDNTzX7E
2,6YL2H8K0xeMeAy0dqyAWw4,117: Te falta el vocoder y sos Magnetto,2023-09-22,"La película de este episodio es Rotting in the Sun (2023) de Sebastián Silva. Muchos pitos, un perrito, una señora atribulada, un influencer perdido y otros mambos. Claro que hay coyuntura y, AH, ANUNCIO IMPORTANTE sobre *el otro podcast*.  🐐 Si querés más de todo esto pasá por hoytrasnoche.com 🐐  Conducen Fiorella Sargenti y Santiago Calori. ",4277446,https://open.spotify.com/episode/6YL2H8K0xeMeAy0dqyAWw4
3,1lzaslzGmPKErx5vBr6jJC,116: Hay un hilo rojo entre vos y los copitos,2023-09-15,"Netflix estrenó El Conde (2023), la nueva película de Pablo Larraín en la que Pinochet es Drácula, y Flor y Calu la vieron. Es un título particularmente interesante para charlar (justo ahora), para pensar cómo y cuándo repasamos cinematográficamente la historia. En coyuntura tenemos un poco de Sean Penn, un poco de Drew Barrymore y otro poco de no sé qué.  Para cerrar: el caso Danny Masterson, Scientology, Ashton Kutcher, true crime. 🐐 Si querés más de todo esto pasá por hoytrasnoche.com 🐐",4973897,https://open.spotify.com/episode/1lzaslzGmPKErx5vBr6jJC
4,3SJTwkPCBzAlMUSxPnXTh8,115: Es como coger con alguien que trabaja en el Puerto de frutos,2023-09-08,"Con los actores de paro los directores siguen hablando, hablando y hablando. Por un lado David Fincher, Richard Linklater y Nicolas Winding Refn opinan de cosas. Por el otro en Venecia terminó el festival del cancelado, a Woody Allen lo aplaudieron y el tipo se metió a decir cualquier cosa mientras que Roman Polanski se fue goleado. Santiago Calori y Fiorella Sargenti también hablan del tema de Rotten Tomatoes y vieron una película que se llama Perpetrator (2023). 🐐 Si querés más de todo esto pasá por hoytrasnoche.com 🐐",4714501,https://open.spotify.com/episode/3SJTwkPCBzAlMUSxPnXTh8
5,72f2za90l1aEwCUyxOW7ma,114: Moyano o Mad Max,2023-09-01,"Calo y Flor día se decidieron y vieron eeesssa película que tanto pedían: Háblame (Talk to Me) de Danny y Michael Philippou. 🤝 También encontrás alguna que otra charla sobre edadismo en la industria del entretenimiento, patrones de belleza destructivos, billonarios tristes y productores con delirio mesiánico. 🐐 Si querés más de todo esto pasá por hoytrasnoche.com 🐐",4841038,https://open.spotify.com/episode/72f2za90l1aEwCUyxOW7ma
6,7nK48l3gOkoAHoImA3Bkrq,113: La que le sacó la nariz a Voldemort,2023-08-25,"Este es un episodio de Hoy Trasnoche en el que SE HABLA DE UNA PELÍCULA DE SUPERHÉROES QUÉ ESTÁ PASANDO DIOS. Sí, es Blue Beetle pero a la vez más que eso porque también charlamos sobre Flash, James Gunn, cómo desvarió Marvel y más. Para saber si es joda o no vas a tener que escuchar.",4717087,https://open.spotify.com/episode/7nK48l3gOkoAHoImA3Bkrq
7,5t6rd6KmCtJ1Fhrm9w2V2V,112: Lars Von Trier es Gerardo Romano con talento,2023-08-18,"Esta semana tocó etiqueta “documental”: Bama Rush (2023) de Rachel Fleit y Beyond Human Nature (2023) de Michael Neelsen.  Como cuestiones varias también se charla sobre el reclamo sindical de la actriz de La Monja por el uso de su imagen, la polémica por la nariz de Bradley Cooper y la performance busca novia de Lars Von Trier. Si te gusta este podcast podés ayudar a que siga existiendo suscribiéndote en hoytrasnoche.com, ¿exagerados y tremendistas? Pero claro.",4836127,https://open.spotify.com/episode/5t6rd6KmCtJ1Fhrm9w2V2V
8,6LuA2Qqcg8UlAz8UAVEChK,111: Se fue un gran amigo,2023-08-11,"En este Ayer Trasnoche Santiago Calori y Fiorella Sargenti (aka Calu y Flor) homenajean al director William Friedkin. Sí, el de El Exorcista y Contacto en Francia, pero no eligieron ninguna de esas dos películas como eje así que mis-te-rio.Seguimos con la saga ""¿qué vio Paul Schrader?"" y tal vez aparece por ahí un ""devolvé la guita"" para Ridley Scott.(Si te gusta este podcast andá a hoytrasnoche.com y suscribite para escuchar contenido exclusivo, dale)",5110047,https://open.spotify.com/episode/6LuA2Qqcg8UlAz8UAVEChK
9,1yiU0DjQjfnL5uOHrQfqSW,110: Ese es el problema de la democracia,2023-08-04,"En un episodio maratónico Calu y Flor se meten, de una forma u otra, con dos películas.  Hubo indignación, confusión y más pero no te vamos a decir cuales son, vas a tener que darle play.  Bah, no, a ver, pará, no digas nada pero una de ellas es La Noche del Demonio: La Puerta Roja, de Patrick Wilson. Por el mismo precio también te llevás una actualización sobre la huelga de actores y guionistas en Hollywood y una mini guerra civil: El Conjuro vs Insidious.",5197374,https://open.spotify.com/episode/1yiU0DjQjfnL5uOHrQfqSW
10,5KvDc261Drt3VL7NfkavHi,109: El festival de los arruinaguacho,2023-07-28,"Calu (Santiago Calori) y Flor (Fio Sargenti) vieron Limbo, película australiana de Ivan Sen. Probablemente no la tenías en el radas, no te preocupes, es normal. Sigue algún que otro debate y cuestión sobre Barbenheimer, la huelga y ciertas invitaciones al Festival de Venecia. AH, ADEMÁS HAY UN ANUNCIO MEGA ULTRA CLAVE.",4373368,https://open.spotify.com/episode/5KvDc261Drt3VL7NfkavHi
11,2yAid3vEBF9KDjlpfrIiqB,108: Parece un video de Brazzers,2023-07-21,"¿Hace cuánto que Flor viene hablando de Barbenheimer? LLEGÓ, NO TE LA PODÉS CREER. Obvio que hubo doble función y en este episodio se habla de Barbie de Greta Gerwig y Oppenheimer de Christopher Nolan. ¿Valió la pena la epopeya? No sé, escuchá que es gratis. La coyuntura sigue invadida por el Hollywood piquetero pero hay alguna que otra cosa más. Y VOLVIÓ SANTIAGO CALORI, SÍ, TODO ASÍ CAPS LOCK.",5563010,https://open.spotify.com/episode/2yAid3vEBF9KDjlpfrIiqB
12,7GHd0Q0hizxaxm78Ys16xm,El Show de Flor: Meando las puertas de Versalles,2023-07-14,"Para el último episodio de esta tanda de especiales sin Santiago Calori Flor invitó a Guillermo Houdin -Mow-, bajista de Los Antiguos y gran ser humano en general, también conocido como su novio. La película elegida es Asteroid City (2023) de Wes Anderson y claro pero por supuesto cómo que no se habla largo y tendido del momento histórico que está atravesando Hollywood con la huelga de actores. Gracias por escuchar, ha sido un placer. ",4358060,https://open.spotify.com/episode/7GHd0Q0hizxaxm78Ys16xm
13,7c3uPK1tTnNXhvIx8UUk9a,"El Show de Flor: Ella tosió, yo tosí y nadie rio",2023-07-07,"Se ha dejado absolutamente todo para grabar este episodio así que más vale que lo escuches. Con faringitis y todo Flor grabó como se pudo porque sino después dicen que no es viernes si no hay Hoy Trasnoche y todo eso. Tenemos dos películas y dos invitados: Fer Mugica y José Tripodero. Periodistas, críticos de cine y colaboradores de la versión vip de Míralos Morir, el newsletter de un tal Santiago Calori. Lujo.  Hablamos de Are You There God? It's Me, Margaret (dirigida por Kelly Fremon Craig) y Sanctuary (Zachary Wigon). Coyuntura a rolete. Aparecen Russell Crowe, una versión ""a lo Spike Jonze"" del dinosaurio Barney, algo de historia de Warner Bros. y varias cuestiones más.  ¿Volvió Oti? Ah, misterio. ",4485041,https://open.spotify.com/episode/7c3uPK1tTnNXhvIx8UUk9a
14,3RltL2ftFUQRBuh3aQRjsa,El Show de Flor: qué pingo será un dial,2023-07-01,"HOY ES VIER... bueno, ya saben. Flor recibe a su amiga Eli -tal vez la conozcan como @elisblack- para hablar de Indiana Jones y el Dial del Destino, dirigida por James Mangold. Tenemos a Hollywood que tal vez, quizás, quién sabe entra en una de las mayores crisis de su historia y la niñera Fran Drescher es la jugadora clave, un montón de argentinos que se suman para votar en los Oscar, John Landis y el estado de la industria más varias cosas más. Cómo te gustaría estar pagando esto para poder exigir que te devuelvan la guita hoy, eh, cómo sos. Andá a escuchar, querés. ",4300956,https://open.spotify.com/episode/3RltL2ftFUQRBuh3aQRjsa
15,2802DRJIbSVWV5OMBkIw7d,El Show de Flor: Wes Anderson no quiere ver tu video de mierda,2023-06-23,"Santiago Calori decidió abandonar el país por motivos desconocidos, así que durante algunas semanas Hoy Trasnoche se convierte en El Show de Flor (y Oti, claro). En esta ocasión la acompaña un viejo amigo de la casa conocido como Luciano Banchero. La película seleccionada es Blackberry de Matt Johnson. No te hagas el que no sabés qué es un Blackberry porque vemos la demográfica así que SABEMOS TU EDAD.  En coyuntura hay una selección intensa con algunos personajes clásicos como Francis Ford Coppola, Wes Anderson y Christopher Nolan pero también aparece esta cuestión de que vendieron los Globos de Oro y la inteligencia artificial puede convertirse en nuestro nuevo dios todopoderoso. Ahora sólo te queda darle play. Gracias. ",4486870,https://open.spotify.com/episode/2802DRJIbSVWV5OMBkIw7d
16,5pIjiSWwFOmpAJT7yvlVYf,107: Tengo que hurgar un perro en Uruguay,2023-06-16,"¡Llegó el día! Flor y Calu finalmente hablan de The Flash, la película de superhéroes más esperada delAHUDUEJK NO.  La que sí vieron es Beau is Afraid, la tercera de Ari Aster y bueno... sintieron muchas cosas, ¿qué decirte? Ya lo vas a escuchar. James Cameron estuvo en la Argentina y medio que se sintió emosidoengañado, a Netflix le salió bien lo de las contraseñas, Ben Affleck y Matt Damon vs Trump. Hay de todo, vos dale play, estrellitas y todas esas cosas así comemos caliente. Gracias.",4899709,https://open.spotify.com/episode/5pIjiSWwFOmpAJT7yvlVYf
17,5sZ8ZZAygLI3aTwh1gg9zm,106: Con el CBU abierto,2023-06-09,"Bienvenidos a un nuevo episodio de esto que probablemente sea el único podcast de cine y cosas del mundo mundial. En esta ocasión Santiago Calori y Fiorella Sargenti (más Oti) charlan sobre la nueva película de Paul Schrader: El Maestro Jardinero (Master Gardener, 2023). Además tenés algún que otro devuelvan la guita, La Niñera sindicalista, cine y censura, Nolan y Oppenheimer, etc. Vos le das play y nosotros decimos gracias.",4257541,https://open.spotify.com/episode/5sZ8ZZAygLI3aTwh1gg9zm
18,0RdEqcDC7SS5kBGcqKaPCs,105: Un mondongo adentro de una pelota,2023-06-02,"Tarantino tuvo una semana movida y este podcast también. La cantidad de coyuntura y material es realmente impresionante. Fiorella Sargenti (Flor) y Santiago Calori (Calu) también te traen una película, claro. Es Reality, dirigida por Tina Satter y protagonizada por Sydney Sweeney.  Play y coso.",4740048,https://open.spotify.com/episode/0RdEqcDC7SS5kBGcqKaPCs
19,6YYBV3AleVgpnZYBVD2hyA,104: Le sacaste el riñón a uno que necesitaba el trasplante,2023-05-26,"Santiago Calori y Fiorella Sargenti investigan sesudamente el misterio detrás de las extensas ovaciones de pie en Cannes en un nuevo y apasionante episodio del único podcast del mundo mundial.  Después hablan de alguna que otra cosita hasta que llega la película elegida: Mantícora, del español Carlos Vermut. Ahora te toca darle play y hacerlos millonarios. Listo, buenísimo.",5513900,https://open.spotify.com/episode/6YYBV3AleVgpnZYBVD2hyA
20,6auoxtLgQ0SrKOGXSU804y,103: Greta Thunberg es la Juan Carr de ellos,2023-05-19,"-¿La película? Sisu, una especie de John Wick finlandesa.  Pero qué decirles, hay una parva de cosas extra, que van desde Johnny Depp en Cannes, la pelea de Disney con el gobernador de Florida y, por algún motivo misterios, bandas punk con ideologías reprochables. No te lo puedo explicar porque no vas a entender así que dale play y eso.",4300892,https://open.spotify.com/episode/6auoxtLgQ0SrKOGXSU804y
21,2XpHAEMXooZxrMGavMvgCX,102: Menos timing que el Mono Mario,2023-05-12,"¿Ya vieron Misántropo, la nueva película de Damián Szifrón?  Bueno, Santiago Calori y Fiorella Sargenti sí (ah, re serios, qué les pasaba).  Atención porque puede que haya pleito. Obviamente siguen con lo de la huelga de guionistas de Hollywood, que está cada vez más picante. Escuchalo o te spoilean El Padrino. (Nota al pie: este podcast no comulga con esa definición de spoiler)",4705044,https://open.spotify.com/episode/2XpHAEMXooZxrMGavMvgCX
22,2idVUeOL7ohSuKvQYfYQd5,101: Es como caminar sobre cáscaras de huevo,2023-05-05,"Como te veníamos adelantando (ay, ellos) arrancó la huelga del sindicato de guionistas en Hollywood. En este episodio explicamos un poco de qué se trata, qué pasó la última vez y qué consecuencias podría traer esta. Tenemos la aparición de una nueva nepobaby, un devuelvan la guita local pero posiblemente fake y Roman Polanski (¡otra vez!). Además Calu y Flor vieron la de Gladiador Exorcista, también conocida como El Exorcista del Papa, y puede que haya controversia y polémica. AH PERO VAS A TENER QUE ESCUCHAR PARA ENTERARTE.",5236845,https://open.spotify.com/episode/2idVUeOL7ohSuKvQYfYQd5
23,43meeO7lYgx3dpdt3CA3HK,El episodio 100,2023-05-01,Llegó. Acá lo tenés. ¿Qué pasa? ¿Tenés miedo de darle play?,1173397,https://open.spotify.com/episode/43meeO7lYgx3dpdt3CA3HK
24,6xCTkH8XdUuLIJJulGodKC,Tuvieron dos hijos influencers de cine,2023-04-28,"Exceso de coyuntura, exceso de gore mainstream. Calu y Flor (aka Santiago Calori y Fio Sargenti) vieron Renfield y Evil Dead: El Despertar. ¿Sensaciones? Vas a tener escuchar, pero claro.  En cuanto a lo noticioso acá vas a encontrar algo sobre las nuevas estrategias de distribución en Hollywood, qué es CinemaCon, dos hermanos españoles que reclaman que los dejen casarse, Alec Baldwin y una especie de comedia meta con estrellas “polémicas” y más. Eso es todo por ahora. Gracias.",4824920,https://open.spotify.com/episode/6xCTkH8XdUuLIJJulGodKC
25,6P0sr6E7pixtaNnjdfUzKP,El Aleph con Pablo y Pachu,2023-04-21,"Este podcast elige una película por semana y se compromete a dedicarle el episodio aunque no le haya gustado a Calu y Flor. Hay semanas en las que sale bien, hay semanas en las que sale mal. ADIVINÁ QUÉ PASÓ. No pensamos decirles el título ni nada, vas a tener que darle play y chusmear vos mismo. Ah, y no hay coyuntura porque Fio Sargenti decidió hacer paro como los guionistas de Hollywood. O tal vez sí hay. Bueno, no sabemos bien, fijate. Si te interesa todo esto seguimos en @filmejuntoalpueblo (Instagram). Nos vemos el viernes que viene… probablemente, qué sé yo, ni idea, puede ser.",4695875,https://open.spotify.com/episode/6P0sr6E7pixtaNnjdfUzKP
26,3oA0P6ZOCi2tyKMFP7Nj0C,Puntos suspensivos es sinónimo de coger,2023-04-14,"¿Es acaso este un podcast de zapatillas? No, pero esta vez un poco sí. Flor y Calu hablan de Air, la nueva película de Ben Affleck en la que cuentan la historia detrás del arreglo entre Nike y Michael Jordan.  La coyuntura nos lleva para el lado de HBO Max (#blessed) y el debate de qué es premium y qué no, por qué Tarantino no pone escenas de sexo en sus películas y cuán argentina es realmente la ex de DiCaprio. Woody Harrelson y Matthew McConaughey: ¿descubrieron que son hermanos bastardos o simplemente están chiveando un nuevo curro? Temazos la verdad, eh. Nos escuchás acá y podés seguirnos en Instagram si buscás @filmejuntoalpueblo.",4781714,https://open.spotify.com/episode/3oA0P6ZOCi2tyKMFP7Nj0C
27,7a6llfoTFjyOThel9KxRZg,En ninguna situación el esperma de un hijo debe estar adentro de una madre,2023-04-07,"Hola, somos un podcast de cine. Santiago Calori y Fiorella Sargenti hablan de una película en particular, de algunas cuestiones noticiosas y algún que otro capricho. A veces sale bien, a veces no tanto. En este episodio comentan Boksoon Debe Morir, una producción coreana distribuida por Netflix. En el picoteo coyunturesco aparecen John Leguizamo y Super Mario, cambios en las reglas de los Oscar, Gwyneth Paltro y el juicio más blanco de la historia, el tráiler de Barbie y andá a saber qué cosa más.  Ojo, George Lucas, porque en El Club de los Divorciados comienza su historia de amor y desamor con Marcia, su primera esposa. Play, estrellitas, corazón, guita y todo eso. Gracias.",5249488,https://open.spotify.com/episode/7a6llfoTFjyOThel9KxRZg
28,7i6w2DQ1cVydQqg005KquV,Podés ver Elsa y Fred o podés ver John Wick 4,2023-03-31,"Santiago Calori y Fiorella Sargenti en un sentido homenaje a Keanu Reeves y su legado como hombre de acción. O sea, hablan de John Wick. La nueva, la saga entera, las influencias y lo que dicen que se viene. La coyuntura es breve pero suculenta: ¿es acaso Argentina la culpable del gran escándalo hollywoodense actual? Victoria Alonso, Marvel y cómo tratar de leer este tipo de noticias. Además hablamos de UNA DE LAS MEJORES PELÍCULAS DEL AÑO, pero vas a tener que escuchar el episodio para enterarte de cuál es. Si querés más vas a Instagram y buscás @filmejuntoalpueblo. Ahora sí, buen provecho.",4827193,https://open.spotify.com/episode/7i6w2DQ1cVydQqg005KquV
29,0gmziX1UnNtzahl0hbRtXa,El buttplug y el juguete de perro son intercambiables,2023-03-24,"AGHJKLLLRRRKASARRRRRR. O sea, traduciendo a Cocaine Bear: ¡al fin viernes, viejo! Hay un nuevo episodio de Hoy Trasnoche con coyuntura por demás suculenta (nueva generación de nepo babies Coppola, Tom Cruise ama una película de la competencia, etc) + Calo y Flor celebrando la llegada de Oso Intoxicado. Caos, humor, gore, ¿qué decirles?  Por acá está el botoncito de play, ya sabés cómo sigue la cosa.",4552515,https://open.spotify.com/episode/0gmziX1UnNtzahl0hbRtXa
30,3z6UQciVmiOCY1bffilZ2u,Pobrecita: es bruta,2023-03-17,"¿Te acordás de esa que se llamaba Searching? Bueno, ahora hay una que se llama Missing (acá le pusieron Desconectada). Calo y Flor la vieron. También hablan sobre la copa que ""perdimos"", la ¿última? película de Tarantino, posible plagio al hijo de Barry Levinson y más cosas que ya ni se acuerdan. Para cerrar: El Club de los Divorciados con Steven Spielberg y AVANT PREMIERE DE OSO INTOXICADO. De nada.",5691219,https://open.spotify.com/episode/3z6UQciVmiOCY1bffilZ2u
31,3WmzJOmyRzZBrfbjDENDQ7,Todos somos la segunda marca de alguien,2023-03-10,"Lo esperabas, lo pedías, acá está: el capítulo de La ballena (The Whale, 2022). Calu y Flor se meten con el regreso de Brendan Fraser, la carrera de Darren Aronofsky, pizza con mayonesa sí o no y todas esas cosas. Bueno, claro, además parece que se vienen los Oscar así que se habla un poco del tema, sobre todo porque estamos esperando ESE resultado. En coyuntura tenemos un poco de Nic Cage, otro poco de Michelle Yeoh y su campaña dudosa, Linklater y un rodaje de 20 años, etc. Sale ese play, perfecto, sí, bárbaro.",4703843,https://open.spotify.com/episode/3WmzJOmyRzZBrfbjDENDQ7
32,7h0N28XbbhJ2NkIU62ONNW,No me sale lo femenino,2023-03-03,"Finalmente se les dio y Flor y Calu pueden hablar de las dos películas que querían emparejar desde hace rato: Ella dijo (She Said, 2022) de Maria Schrader y Ellas hablan (Women Talking, 2022) de Sarah Polley.  Además tenés como una hora de coyuntura en la que se comentan novedades de la entrega de los Oscar, el jetlag de Chris Pine, Donnie Yen contra los estereotipos asiáticos y puede que alguna cosa como Anama Ferreyra contra Poroto Cubero.  This is agarrar la pala.",5887817,https://open.spotify.com/episode/7h0N28XbbhJ2NkIU62ONNW
33,2PUcIhb1Gd479AbMmO9bCM,Sarah Connor: mamá luchona,2023-02-17,"Llegó una de esas películas que Calu y Flor estaban esperando con muchas ganas. En este capítulo hablan de Infinity Pool (2023), dirigida por Brandon Cronenberg, uno de los nepobabies favoritos de la casa. La coyuntura incluye una comparación de alturas entre Ricardo Darín y Tom Cruise, la prueba de Marc Maron para Avatar 2, Kristen Stewart -presidenta del jurado de la Berlinale- que no puede mencionar ni una película europea que le guste, sigue el mambo de los Oscar y ya que estamos despedimos el acento de Elvis de Austin Butler. Para cerrar Flor abrió su Club de los Divorciados con la historia de James Cameron, el hombre que jamás estuvo soltero. A esto le das play. No, de nada. ❤️",5457841,https://open.spotify.com/episode/2PUcIhb1Gd479AbMmO9bCM
34,5qVGUbXCnhQA1m0jLR9Q8t,Los ángeles de la droga,2023-02-10,"Dos fijas: el que puso dólares recibirá dólares y los viernes sale Hoy Trasnoche. Por eso acá tenés a Calu, Flor y Oti hablando sobre cin… bueno, tampoco vamos a mentirte. La cosa arranca con la muerte de Rodrigo, Walter Olmos, cumbia villera vs cuarteto, ruleta rusa y true crime patagónico. ¡Ah, pero después! Coyuntura de la que te gusta: habló Armie Hammer, cines con precio diferenciado por ubicación, ¿muere o no muere HBO Max? y más. La película, sí, porque hay una pelícua, no te la podés creer, es la biopic Quiero bailar con alguien (Whitney Houston: I Wanna Dance with Somebody, 2022) de Kasi Lemmons. Se vuelve a hablar de Bohemian Rhapsody, claro. Dijo Flor que acá arrancaba la saga El Club de los Divorciados pero andá a saber.",5181466,https://open.spotify.com/episode/5qVGUbXCnhQA1m0jLR9Q8t
35,2KVgbJ6bZbO7JRT7DgaKTA,¿Esto se puede coger?,2023-02-03,"Y es de esta manera que estamos otra vez en viernes y como todos los viernes sin excepción hay un nuevo episodio de Hoy Trasnoche. En esta ocasión, Flor y Calu (Oti estaba con calores y el chico de redes también) se meten en las coyunturas más variadas que empiezan con el el VHS que dicen que separó a los Redondos, que nos lleva a hablar de cómo funciona el cerebro de Flor, que nos lleva a un intento de paralizar candidatas al Oscar con participantes de Gran Hermano, que nos lleva a volver a hablar porque sigue la cantinela con la de Mandy nominada a mejor actriz, al anuncio de incluso otra película de Roman Polanski y Venecia y Cannes peleándose por no agarrarla, al reality show de Stallone con las hijas y hasta la biopic de Michael Jackson. Y vos dirás ""Bueno, muy completo"" pero no: aún hay más, porque vieron una película. La elegida es Sick (2022) de John Hyams. Y parecería que ahí está, pero Flor medio que metió un capricho con una reseña que nadie le pidió de Espíritus de la isla (The Banshees of Inisherin, 2022) de Martin McDonagh. Y ahí sí. Listo. No pidas más. O poner guita.",4988316,https://open.spotify.com/episode/2KVgbJ6bZbO7JRT7DgaKTA
36,6WaXf3nQZ9eTjdrQJ4QpEx,No me siento un poco bien,2023-01-27,"Sí, estás en lo cierto: es viernes. Y como todos los viernes (el pasado, sin ir mas lejos) hay un nuevo episodio de Hoy Trasnoche. Esta semana (como todas las semanas, por si hiciera falta repetirlo) Flor y Calu (sin Oti, porque Flor al final la puso en un sitio de subastas a ver si le saca una guita ni el chico de redes, que ya subastó todo hace tiempo) se meten en las coyunturas más variadas, como: todo lo que no querías saber sobre la situación psiquiátrica de Flor, las nominadas al Oscar porque ¡estamos nominados todos!, la biopic de Madonna que al final parece que no, Julian Sands que no lo encuentra nadie, los boludos de los Razzies contra la nena de Firestarter, Jared Leto haciendo ¡Tron 3! Y alguna que otra delicatessen más. Y como si todo eso fuera poco, vieron dos películas. Las elegida de esta semana son There's Something Wrong with the Children (2023) de Roxanne Benjamin y M3GAN (2022) de Gerard Johnstone. Y la verdad que nada más. O sí. Andá a saber. Vas a tener que escuchar.",5347239,https://open.spotify.com/episode/6WaXf3nQZ9eTjdrQJ4QpEx
37,4iQ3dSpasgP9vWkktKNrvG,Los papitos separados,2023-01-13,"Hola, es viernes, es enero y hay un nuevo episodio de Hoy Trasnoche. Como siempre. Eh. Como siempre. En esta edición Flor y Calu (a Oti Flor la dejó en un auto en estacionamiento de un super al sol y el chico de redes parece que volvió de Panamá con ganas de casarse) se meten en las coyunturas más variadas, como por ejemplo: ¡GANAMOS un Golden Globe!, Tom Hanks defendiendo a los nepobabies, tema que nos llevó a hablar de El hotel de los famosos no sabemos muy bien por qué, Edward Norton descendiente de Pocahontas y alguna que otra cosa más. Un lujo para esta altura del año, imaginate si a eso le agregamos que vieron una película europea: la elegida es la suiza Mad Heidi (2022) de Johannes Hartmann y Sandro Klopfstein. Y qué suerte que leíste hasta acá, porque hay una entrega urgentísima de Los caprichos de Flor con todo el puterío de los papis de Spielberg. La verdad que si lo tuviéramos que tasar, esto tiene un valor incuantificable. Y vos te lo estás llevando de arriba. Qué decirte.",4037694,https://open.spotify.com/episode/4iQ3dSpasgP9vWkktKNrvG
