,id,name,release_date,description,duration_ms,url
137,1cxIFDgXc34iU6FXuxhmbA,Botón de desver,2020-05-29,"La vida es horrible y algunas películas también, por eso este episodio de Hoy Trasnoche contiene escenas muy explícitas de indignación de nuestros héroes, Calu y Flor. ¿Por qué? Porque esta semana vieron no una sino DOS porongas y vas a tener que escuchar el capítulo para descubrir cuáles son. En el portarretratos, el actor David Hess. Flor se encapricha con la historia de la película Freaks. Y Calu abre su videoclub para recomendarnos Las Fotos Prohibidas de una Mujer Decente.",3146945,https://open.spotify.com/episode/1cxIFDgXc34iU6FXuxhmbA
138,3ona5uvGW32zBIUflBPoOg,Hoy Trasnoche Diario: Serial Mom,2020-05-29,ÚLTIMO EPISODIO DIARIO AHHHHHH,698358,https://open.spotify.com/episode/3ona5uvGW32zBIUflBPoOg
139,3nkYTmZX2hcaHBd1ODrpj3,Hoy Trasnoche Diario: Altered States,2020-05-28,"Todos los días, una nueva recomendación de Calu y Flor, para que nunca más digas que no sabés qué película ver.",461845,https://open.spotify.com/episode/3nkYTmZX2hcaHBd1ODrpj3
140,3ww7m9E5kLum3Xrp0t8DVl,Hoy Trasnoche Diario: Henry - Portrait of a Serial Killer,2020-05-27,"Todos los días, una nueva recomendación de Calu y Flor, para que nunca más digas que no sabés qué película ver.",507429,https://open.spotify.com/episode/3ww7m9E5kLum3Xrp0t8DVl
141,6HbpsEQ1edBT7sIVwGDJhy,Hoy Trasnoche Diario: Confessions of a Dangerous Mind,2020-05-26,"Todos los días, una nueva recomendación de Calu y Flor, para que nunca más digas que no sabés qué película ver.",509806,https://open.spotify.com/episode/6HbpsEQ1edBT7sIVwGDJhy
142,2qOoIQb7TghHz5OV6ZLXAk,Hoy Trasnoche Diario: The Girl,2020-05-25,"Todos los días, una nueva recomendación de Calu y Flor, para que nunca más digas que no sabés qué película ver.",284865,https://open.spotify.com/episode/2qOoIQb7TghHz5OV6ZLXAk
143,1U5HwQ9Gs92ktlCamG87De,Hoy Trasnoche Diario: Cast a Deadly Spell,2020-05-24,"Todos los días, una nueva recomendación de Calu y Flor, para que nunca más digas que no sabés qué película ver.",320235,https://open.spotify.com/episode/1U5HwQ9Gs92ktlCamG87De
144,48cMkYN6aEPoOwzirD7vl2,Hoy Trasnoche Diario: Bonnie and Clyde,2020-05-23,"Todos los días, una nueva recomendación de Calu y Flor, para que nunca más digas que no sabés qué película ver.",396069,https://open.spotify.com/episode/48cMkYN6aEPoOwzirD7vl2
145,6OjYjSf3ZUM78V6HcUgmSX,Hay una dignidad en el pañal,2020-05-22,"EL EVENTO PODCASTERO MÁS ESPERADO DE LA DÉCADA FINALMENTE ESTÁ AQUÍ: un nuevo episodio de Hoy Trasnoche, igual que todos los otros viernes. Esta semana, Calu y Flor vieron Buffaloed y Capone. En el portarretratos, brilla la actriz rusa Olga Baclanova. En los caprichos de Flor: el nuevo documental sobre la misteriosa muerte de Natalie Wood. En el videoclub de Calu: Salesman, de David y Albert Maysles. Y sí, se habla del Snyder Cut.",3089737,https://open.spotify.com/episode/6OjYjSf3ZUM78V6HcUgmSX
146,5p5LKZjbyk3BwhPx3gxsQM,Hoy Trasnoche Diario: Hustlers,2020-05-22,ESTAFADORAS DE NUEVA YORK,497894,https://open.spotify.com/episode/5p5LKZjbyk3BwhPx3gxsQM
147,3Kgt2KFVbeFe9d0M6Q3a0C,Hoy Trasnoche Diario: The Willoughbys,2020-05-21,Flor se hizo un test de personalidad y recomienda una de dibujitos.,336144,https://open.spotify.com/episode/3Kgt2KFVbeFe9d0M6Q3a0C
148,53tkFc9x9fw3XmH32WZEM4,Hoy Trasnoche Diario: Death Wish,2020-05-20,Ganas de morirse.,327419,https://open.spotify.com/episode/53tkFc9x9fw3XmH32WZEM4
149,3FpsHL2XlZXKHKIeRg557I,Hoy Trasnoche Diario: This Is Spinal Tap,2020-05-19,PONÉ EL VOLUMEN EN ONCE,602540,https://open.spotify.com/episode/3FpsHL2XlZXKHKIeRg557I
150,3Ju3sfFK5zxailTexoEtrM,Hoy Trasnoche Diario: Boogie Nights,2020-05-18,NOCHES DE PLACERRRRRR,516833,https://open.spotify.com/episode/3Ju3sfFK5zxailTexoEtrM
151,4BdK7byT7hs0WLHtWSxu07,Hoy Trasnoche Diario: Skin,2020-05-17,Hoy recomienda Flor.,386821,https://open.spotify.com/episode/4BdK7byT7hs0WLHtWSxu07
152,6in5WrPh12qHTOzgKldxQN,Hoy Trasnoche Diario: Red State,2020-05-16,Una que le salió bien a Kevin Smith.,296620,https://open.spotify.com/episode/6in5WrPh12qHTOzgKldxQN
153,093BH56wnp7VzVsGVd3Ejh,La corneta fantasmagórica,2020-05-15,"¡Es viernes y tu cuerpo NO lo sabe! Por eso, acá está el nuevo episodio del clásico, viejo, querido y semanal Hoy Trasnoche. Para que busques en Los Incas y Torrent: The Assistant. En el portarretratos: Charles Dennis Buchinsky. ¿Quién? Tal vez lo conozcas como Charles Bronson. En los caprichos de Flor, los fantasmas del Hotel Roosevelt. Y en el videoclub de Calu: Hard Times, de Walter Hill.",3035533,https://open.spotify.com/episode/093BH56wnp7VzVsGVd3Ejh
154,0PDMHzkx2om7Gg31kEeKJM,Hoy Trasnoche Diario: HyperNormalisation,2020-05-15,La nueva hipernormalidad.,383504,https://open.spotify.com/episode/0PDMHzkx2om7Gg31kEeKJM
155,7B3rJ9qkbR4URx0vzf29tD,Hoy Trasnoche Diario: The Gift,2020-05-14,Un regalito.,383504,https://open.spotify.com/episode/7B3rJ9qkbR4URx0vzf29tD
156,48r8Eqv2mWSDAwlru7XMIZ,Hoy Trasnoche Diario: The Skeleton Twins,2020-05-13,Una con Bill Hader y Kristen Wiig.,410514,https://open.spotify.com/episode/48r8Eqv2mWSDAwlru7XMIZ
157,4n7SPNuS0iZgsfQWWuR9hw,Hoy Trasnoche Diario: Pain & Gain,2020-05-12,La buena de Michael Bay.,436715,https://open.spotify.com/episode/4n7SPNuS0iZgsfQWWuR9hw
158,6TbdZlzE9HzBh946I7fpyA,Hoy Trasnoche Diario: Native Son,2020-05-11,"Feliz semana, hoytrasnochiters.",385202,https://open.spotify.com/episode/6TbdZlzE9HzBh946I7fpyA
159,4j7PyYd38PTBIGy1hA4yIT,Hoy Trasnoche Diario: Big Bad Wolves,2020-05-10,AAAAAUUUUUUUUUUUUUUUUUUUUU,347115,https://open.spotify.com/episode/4j7PyYd38PTBIGy1hA4yIT
160,0cpNMHr8iBenFWSUuRhAGx,Hoy Trasnoche Diario: The Witness,2020-05-09,SÁBADO DE DOCUMENTALES,468663,https://open.spotify.com/episode/0cpNMHr8iBenFWSUuRhAGx
161,1UGHiCxhTtBCzoVenIMriX,María Aurelia Paula Martínez Suárez,2020-05-08,"¡Salió Hoy Trasnoche, la única señal válida de que es viernes y se terminó la semana en este nuevo mundo fuera del tiempo! Calu y Flor vieron The Lodge y la recomiendan ampliamente. En el portarretratos tenemos Sonny Chiba. En los Caprichos de Flor: más hoteles. Y en el videoclub del tío: Una Bala en la Cabeza, de John Woo.",3002932,https://open.spotify.com/episode/1UGHiCxhTtBCzoVenIMriX
162,7f5fsfMyQPcqus8XoSlIQx,Hoy Trasnoche Diario: The Faculty,2020-05-08,AULAS PELIGROSAS,632607,https://open.spotify.com/episode/7f5fsfMyQPcqus8XoSlIQx
163,6QzdS58QeVhuEL8ssSyFJ0,Hoy Trasnoche Diario: The Banana Splits Movie,2020-05-07,TRA LA LA TRA LA LA LA,471771,https://open.spotify.com/episode/6QzdS58QeVhuEL8ssSyFJ0
164,4ylzVUL2P8pZ6yCy7PBAE4,Hoy Trasnoche Diario: Little Monsters,2020-05-06,Permeable a una situación de recomendación ofrecida.,344790,https://open.spotify.com/episode/4ylzVUL2P8pZ6yCy7PBAE4
165,6XGKePnC73ODYN75P2j10B,Hoy Trasnoche Diario: Ready or Not,2020-05-05,AKA BODA SANGRIENTA,710635,https://open.spotify.com/episode/6XGKePnC73ODYN75P2j10B
166,7vxfZDkUryVrcGCF2tRTTr,Hoy Trasnoche Diario: Bad Education,2020-05-04,"Significa ""mala educación"".",450873,https://open.spotify.com/episode/7vxfZDkUryVrcGCF2tRTTr
167,0P8Jb2Y1xQ3uXXaHlhQHMD,Hoy Trasnoche Diario: La Historia de Ricky,2020-05-03,CALU LE RECOMIENDA UNA CHINA A FLOR,355109,https://open.spotify.com/episode/0P8Jb2Y1xQ3uXXaHlhQHMD
168,5xsggHQpT3yicgH2rnS9s8,Hoy Trasnoche Diario: Sorcerer,2020-05-02,Un clásico ignorado del director de El Exorcista.,504738,https://open.spotify.com/episode/5xsggHQpT3yicgH2rnS9s8
169,1bEqD0j3ne6r9VHAEgMl2I,¿Qué carpincho sos?,2020-05-01,"¡Cuando todo lo demás parece perdido, llegan Calu y Flor al rescate con un nuevo episodio de Hoy Trasnoche! Esta semana se meten con el híbrido entre charla TED y stand-up que es La Historia de los Beastie Boys y lo empaquetan con The Punk Singer para que cantes y bailes mientras todo se incendia. THIS IS FINE.",3111079,https://open.spotify.com/episode/1bEqD0j3ne6r9VHAEgMl2I
170,6QXiEX8jxRvW4PnnFw64qL,Hoy Trasnoche Diario: A Simple Favor,2020-05-01,Hacete un favor y escuchá este episodio.,326740,https://open.spotify.com/episode/6QXiEX8jxRvW4PnnFw64qL
171,1xF3agjt33sebRMBEFIERx,Hoy Trasnoche Diario: La larga noche de Francisco Sanctis,2020-04-30,Un episodio corto para una noche larga.,439040,https://open.spotify.com/episode/1xF3agjt33sebRMBEFIERx
172,1d24I1TdFhvUUwS3dA4HCs,Hoy Trasnoche Diario: Cleopatra,2020-04-29,LOS CAPRICHOS DE FLOR,454583,https://open.spotify.com/episode/1d24I1TdFhvUUwS3dA4HCs
173,34i8pQZcNbaHxdoA6vfaHq,Hoy Trasnoche Diario: Tira a Mamá del Tren,2020-04-28,* música de Telefe de los noventa *,650371,https://open.spotify.com/episode/34i8pQZcNbaHxdoA6vfaHq
174,1QoIoWH9GTEUDjN34WpzSt,Hoy Trasnoche Diario: Voyeur,2020-04-27,Empezá la semana con una recomendación bien piola.,331207,https://open.spotify.com/episode/1QoIoWH9GTEUDjN34WpzSt
175,1HaURW8AXnhgLNhFxJNBM0,Hoy Trasnoche Diario: Phil Spector,2020-04-26,Al Pacino fuera de control.,350067,https://open.spotify.com/episode/1HaURW8AXnhgLNhFxJNBM0
176,5m4RjDpoIJ39lwA5nfL9R1,Hoy Trasnoche Diario: Hairspray,2020-04-25,(La de John Waters.),382668,https://open.spotify.com/episode/5m4RjDpoIJ39lwA5nfL9R1
177,2vBiQoovjEAW9sjLQJr5q6,Caca y sangre,2020-04-24,"¡Nuevo episodio del viejo y querido Hoy Trasnoche semanal! Como sigue sin haber cines abiertos y por lo tanto no hay estrenos, Calu y Flor te invitan a ver Butt Boy, una película que es tan Hoy Trasnoche que duele. En el portarretratos: John Larroquette. En los caprichos: última parte de la saga del Chateau Marmont, protagonizada por Lindsay Lohan. Y en el videoclub: Un condenado a muerte se escapa, de Robert Bresson.",2778410,https://open.spotify.com/episode/2vBiQoovjEAW9sjLQJr5q6
178,3mhRaT5bAKHgfTC0zcflxc,Hoy Trasnoche Diario: VFW,2020-04-24,Calu le recomienda a Flor.,365714,https://open.spotify.com/episode/3mhRaT5bAKHgfTC0zcflxc
179,4sEEDCjarYxewOCiVFhRXo,Hoy Trasnoche Diario: Los Sonámbulos,2020-04-23,Flor le recomienda a Calu.,369972,https://open.spotify.com/episode/4sEEDCjarYxewOCiVFhRXo
180,0EogcqqGKh9a6AZINt8Fzx,Hoy Trasnoche Diario: El Fondo del Mar,2020-04-22,¿La mejor de Szifrón? La mejor de Szifrón.,629473,https://open.spotify.com/episode/0EogcqqGKh9a6AZINt8Fzx
181,67IfTgu9qGSf7T9lCAG3r5,Hoy Trasnoche Diario: La Soga,2020-04-21,Una de Hitchcock que inventó un montón de cosas que después viste en otras películas.,482508,https://open.spotify.com/episode/67IfTgu9qGSf7T9lCAG3r5
182,77ldEUYByCL4y8gX2dX9eM,Hoy Trasnoche Diario: Funny People,2020-04-20,Una de Judd Apatow con Adam Sandler.,478354,https://open.spotify.com/episode/77ldEUYByCL4y8gX2dX9eM
183,3FxjMeREOHbbs7ZMwPhSsg,Hoy Trasnoche Diario: Los Paranoicos,2020-04-19,"""Soy Luciano Gauna. He sido un maldito cobarde toda mi vida.""",379559,https://open.spotify.com/episode/3FxjMeREOHbbs7ZMwPhSsg
184,6TeBdpKDvSR4oYxGTmayGm,Hoy Trasnoche Diario: A Simple Plan,2020-04-18,Del director de Spider-Man (?).,329796,https://open.spotify.com/episode/6TeBdpKDvSR4oYxGTmayGm
185,4WWqdAiaGyw75igKY0V7c7,EN ESTE SE HABLA DE POLANSKI,2020-04-17,"¿Cómo saber que es viernes? ¡Porque salió un nuevo episodio del viejo y querido Hoy Trasnoche! Esta semana, Flor y Calo vieron Portrait of a Lady on Fire, de Céline Sciamma, y J'accuse, la nueva de Roman Polanski. Porque sí, en este capítulo se habla de Polanski. En el portarretratos, Jean Rollin y sus películas de vampiros. En los caprichos de Flor, la historia de Billy Wilder. Y en el videoclub de Calo, El Odio, de Mateo Kassovitz.",3462949,https://open.spotify.com/episode/4WWqdAiaGyw75igKY0V7c7
186,6fFdM5vx8EI6mOboP2d4IF,Hoy Trasnoche Diario: Overlord,2020-04-17,La de los zombies nazis.,406152,https://open.spotify.com/episode/6fFdM5vx8EI6mOboP2d4IF
187,2YS6Bvred7bLdH7P0N84nt,Hoy Trasnoche Diario: The Manchurian Candidate,2020-04-16,¿Alguien sabe qué día es hoy?,537496,https://open.spotify.com/episode/2YS6Bvred7bLdH7P0N84nt
188,6zUToveA37oil4Eqmw9cCi,Hoy Trasnoche Diario: El Aura,2020-04-15,La que no es Nueve Reinas.,461662,https://open.spotify.com/episode/6zUToveA37oil4Eqmw9cCi
189,7aUn5lFWHiFzfCxEFzA3AX,Hoy Trasnoche Diario: Little Shop of Horrors,2020-04-14,LA TIENDITA DE FLOR Y CALU,546926,https://open.spotify.com/episode/7aUn5lFWHiFzfCxEFzA3AX
190,7whjSk5cmaaE4X7fG32i7Z,Hoy Trasnoche Diario: The Game,2020-04-13,¿La menos valorada de David Fincher?,340376,https://open.spotify.com/episode/7whjSk5cmaaE4X7fG32i7Z
191,07ud8v5CL516qbKINInuI3,Hoy Trasnoche Diario: Broken Flowers,2020-04-12,"Una de Jarmusch, muy para el domingo.",288104,https://open.spotify.com/episode/07ud8v5CL516qbKINInuI3
192,4KaXpuyZ72VcG7ls6Jd1a9,Hoy Trasnoche Diario: Magnolia,2020-04-11,¿Cómo que no viste Magnolia? ¿CÓMO QUE NO VISTE MAGNOLIA?,359523,https://open.spotify.com/episode/4KaXpuyZ72VcG7ls6Jd1a9
193,26StAVK0AbkF2Q3dOT7MYl,Los leones se divierten,2020-04-10,"¿La de los tigres de Netflix te parece espectacular? Pf. Es porque no viste Roar, la película de gatos grandes de 1981 en la que todo lo que podía salir mal salió mal. Por suerte están Flor y Calu para obligarte (?) a verla. En el portarretratos: Gualterio Jacopetti. En los caprichos: Jean Harlow y Clark Gable. Y en el videoclub: Les Yeux sans visage.",2405616,https://open.spotify.com/episode/26StAVK0AbkF2Q3dOT7MYl
194,7tycdJVnYLvzMlq9TAtDco,Hoy Trasnoche Diario: Behind the Candelabra,2020-04-10,El Soderbergh que le gusta a la gente.,316865,https://open.spotify.com/episode/7tycdJVnYLvzMlq9TAtDco
195,4sHwzWqhMgCi9IdvRVjZ0K,Hoy Trasnoche Diario: All the President's Men + The Report,2020-04-09,ESPECIAL PERIODISTAS SUPERHÉROES,652513,https://open.spotify.com/episode/4sHwzWqhMgCi9IdvRVjZ0K
196,5i6mCjauHa1LEn54tLDnd1,Hoy Trasnoche Diario: Piranha + Gamera: Guardian of the Universe,2020-04-08,ESPECIAL MOSTROS,575269,https://open.spotify.com/episode/5i6mCjauHa1LEn54tLDnd1
197,3q4d1lj0TLPAGiIITCnNWK,Hoy Trasnoche Diario: Grey Gardens + Swiss Army Man,2020-04-07,Te va a caer el Grupo Halcón si seguís bajando películas.,383164,https://open.spotify.com/episode/3q4d1lj0TLPAGiIITCnNWK
198,4QVh9iw1H8h1bswxxlnEtj,Hoy Trasnoche Diario: Tiempo de Revancha + El Fugitivo,2020-04-06,"De día y de noche, todos con Hoy Trasnoche, bailando sin parar...",610717,https://open.spotify.com/episode/4QVh9iw1H8h1bswxxlnEtj
199,2Pm5MR0EdnyZZgTcQYWRe4,Hoy Trasnoche Diario: Gattaca + Panic in Year Zero!,2020-04-05,ESTO ES EL DÍA DE LA MARMOTA VIEJO,553561,https://open.spotify.com/episode/2Pm5MR0EdnyZZgTcQYWRe4
200,1OSMG9pAQ0gH56ByOWMHMB,Hoy Trasnoche Diario: The Imposter + Mommy Dead and Dearest,2020-04-04,Dos documentales y un poco de Verano del '98.,494602,https://open.spotify.com/episode/1OSMG9pAQ0gH56ByOWMHMB
201,5haTR0b8pu55OnOWc33h98,One Supón a Time in Hoy Trasnoche,2020-04-03,"El sueño de Calu y Flor se cumplió y finalmente pueden hacer este podcast sin compartir el mismo espacio físico. En este episodio: Swallow, de Carlo Mirabella-Davis. En el portarretratos: Lloyd Kaufman. En los caprichos de Flor: la muerte de John Belushi. Y en el videoclub del tío Calu: Un Flic, de Jean-Pierre Melville.",2720653,https://open.spotify.com/episode/5haTR0b8pu55OnOWc33h98
202,175towPLhBvhD81WIYx8JY,Hoy Trasnoche Diario: Hot Fuzz + Heat,2020-04-03,CALU Y FLOR TE HACEN EL FIN DE SEMANA,530521,https://open.spotify.com/episode/175towPLhBvhD81WIYx8JY
203,0ScMSK0hgU6ohdpdRKO2QQ,Hoy Trasnoche Diario: Mi Amiga del Parque + Apenas un Delincuente,2020-04-02,Dos películas argentinas que capaz que no viste.,642821,https://open.spotify.com/episode/0ScMSK0hgU6ohdpdRKO2QQ
204,5z0zqA78MgUgPHSLVZwCuU,Hoy Trasnoche Diario: L.A. Confidential + Sunset Boulevard,2020-04-01,La cosa se puso noir.,818181,https://open.spotify.com/episode/5z0zqA78MgUgPHSLVZwCuU
205,2uOrRvoxWw3UyXiYhbLXcS,Hoy Trasnoche Diario: Hunt for the Wilderpeople + Burning,2020-03-31,DOBLE CUARTO DE LIBRA CON QUESO,664163,https://open.spotify.com/episode/2uOrRvoxWw3UyXiYhbLXcS
206,0Szjb8dGXNRgrfcoGsGhQO,Hoy Trasnoche Diario: Barbarella + Marathon Man,2020-03-30,AH BUENO,557140,https://open.spotify.com/episode/0Szjb8dGXNRgrfcoGsGhQO
207,31sHchEwcElHgn24xGawqo,Hoy Trasnoche Diario: Battle Royale,2020-03-29,"DECIME CÓMO HICIERON PARA QUE CALU Y FLOR LABUREN UN DOMINGO. Hoy: Battle Royale (2000), de Kinji Fukasaku.",397949,https://open.spotify.com/episode/31sHchEwcElHgn24xGawqo
208,1IksM1dNmC9dcZmVRLDesX,Hoy Trasnoche Diario: An American Werewolf in London,2020-03-28,"¿ESTO TAMBIÉN SALE LOS FINES DE SEMANA? PERO OBVIO QUE SÍ. Y hoy Calu y Flor te traen un clásico: An American Werewolf in London (1981), de John Landis.",458240,https://open.spotify.com/episode/1IksM1dNmC9dcZmVRLDesX
209,7jZcaBi6bL2gkwO6TJMP1k,Este tampoco es el episodio 100,2020-03-27,"NO ES EL EPISODIO 100. NO ES HOY TRASNOCHE DIARIO. ES UN EPISODIO NORMAL DE HOY TRASNOCHE. Bueno... ""normal"". Flor y Calu se juntaron A DISTANCIA, cada uno en su casas, para repasar qué se estuvo estrenando. O sea, nada. Por eso, nuevamente empujados a la delincuencia, comentan The Hunt (La Cacería). Hay portarretratos y está Brian de Palma. Hay caprichos de Flor y está Howard Hughes. Hay videoclub y está Out of the Past. Quedate en tu casa, escuchá Hoy Trasnoche.",3038589,https://open.spotify.com/episode/7jZcaBi6bL2gkwO6TJMP1k
210,3NsAONvAtDxX0thtfFo9BR,Hoy Trasnoche Diario: Gone Girl,2020-03-27,"Hoy: Gone Girl (2014), de David Fincher. AH NO LA PODÉS CREER.",535510,https://open.spotify.com/episode/3NsAONvAtDxX0thtfFo9BR
211,714dPMmcW2pKWvUpBXb2Xi,Hoy Trasnoche Diario: Cold Pursuit,2020-03-26,"¿Una con Liam Neeson? Una con Liam Neeson. Hoy, Calu y Flor recomiendan Cold Pursuit (2019), de Hans Petter Moland.",316918,https://open.spotify.com/episode/714dPMmcW2pKWvUpBXb2Xi
212,47uwLJMJPk9juH0k43kFme,Hoy Trasnoche Diario: The Invitation,2020-03-25,"¿Vos decís que Calu y Flor ya se arrepintieron de esta jodita de grabar todos los días? Escuchá para enterarte y de paso te recomiendan un peliculón: The Invitation (2015), de Karyn Kusama.",284891,https://open.spotify.com/episode/47uwLJMJPk9juH0k43kFme
213,3uPlnjbMQMNj1JzQr8lfVq,Hoy Trasnoche Diario: Very Bad Things,2020-03-24,"AH... ¿¿¿ERA POSTA LO DE QUE SALÍAN TODOS LOS DÍAS??? En este segundo Hoy Trasnoche Diario, Calu y Flor te recomiendan Very Bad Things (1998), de Peter Berg, porque nadie más va a hacerlo.",288078,https://open.spotify.com/episode/3uPlnjbMQMNj1JzQr8lfVq
214,7jZgzeeb4NutCDlWoAGaT7,Hoy Trasnoche Diario: The Warriors,2020-03-23,"¿Ya no sabés qué película ver? ACÁ LLEGAN CALU Y FLOR AL RESCATE. Todos los días, escuchá un nuevo episodio de Hoy Trasnoche Diario. Claro, porque es diario. Recomendaciones cortitas que probablemente no te hicieron. En este primer episodio: The Warriors (1979), de Walter Hill.",447478,https://open.spotify.com/episode/7jZgzeeb4NutCDlWoAGaT7
215,6ITrKiYfcqmUKJWfH5vgiz,HOY CORONGA,2020-03-20,"CUARENTENA ATR CALU Y FLOR TE INVITAN A VER LA QUE ACASO SEA LA PEOR PELÍCULA DEL SIGLO VEROTIKA, DE GLENN DANZIG ES ASÍ: BUSCALA EN ***LOS INCAS Y TORRENT*** Y PONÉ PLAY PARA VERLA JUNTO A TUS ÍDOLOS DE POSTA PUNTO COM",5787648,https://open.spotify.com/episode/6ITrKiYfcqmUKJWfH5vgiz
216,7MMrz8RybGYJaHPOYf0p1u,Hoy Trastorrent Vol. 2,2020-03-06,"La piratería es ilegal, amiguites. No intenten en sus casas nada de lo que dicen Calu y Flor. DICHO ESO: ESTA SEMANA LOS ESTRENOS SON TAN CHOTOS QUE SACAMOS UN NUEVO EPISODIO DE HOY TRASTORRENT. ¿Qué tenés para ver? Color Out of Space, de Richard Stanley, y Queen & Slim, de Melina Matsoukas. ¿Y Flor sigue hablando de Natalie Wood? La respuesta no te sorprenderá.",3344065,https://open.spotify.com/episode/7MMrz8RybGYJaHPOYf0p1u
217,3a5iFwBQe9KXEm8XNMxTH4,Los perritos y la falopa,2020-02-28,BIENVENIDOS AL EPISODIO NUEVO 768 DE LA TEMPORADA 43 DE HOY TRASNOCHE HOY: EL HOMBRE INVISIBLE LINDA BLAIR EN EL PORTARRETRATOS KIRK DOUGLAS Y NATALIE WOOD EN LOS CAPRICHOS DE FLOR UN GATO EN EL CEREBRO EN EL VIDEOCLUB DE CALU Y MÁS. ESCUCHALO ANTES DE QUE SE ECHE A PERDER EL CADÁVER DE DANIELITO DALE,3675768,https://open.spotify.com/episode/3a5iFwBQe9KXEm8XNMxTH4
218,7HWfDjowL30FASReMCVxsP,No estoy defendiendo a Biondini,2020-02-20,"NUEVA TEMPORADA DEL ÚNICO Y MEJOR PODCAST DE CINE DE POSTA PUNTO COM.  Calu y Flor vuelven recargadísimos después de su retiro espiritual y nos traen un montón de novedaLAS MISMAS COSAS DE SIEMPRE. Se estrenó Bombshell (El Escándalo), así que hablan de películas de periodistas y basadas en hechos reales. En el portarretratos: Atuk, el esquimal maldito. En los caprichos de Flor: la desaparición de Jean Spangler. Y en el videoclub del tío Calu: Daniel Isn't Real. Este episodio de Hoy Trasnoche está presentado POR TU VIEJA.",3238504,https://open.spotify.com/episode/7HWfDjowL30FASReMCVxsP
219,36lfPTZubYcU532cxGOZUN,EL PRODE DE LOS OSCAR 2020,2020-02-07,"LLEGÓ EL MOMENTO MÁS FELIZ DEL AÑO. En vísperas de una nueva entrega de los premios Oscar, Flor y Calu vuelven POR ÚNICA VEZ para deleitarnos con sus elegidos, desde la cabeza y desde el corazón. ¡Hacé tu prode con Hoy Trasnoche!",4050521,https://open.spotify.com/episode/36lfPTZubYcU532cxGOZUN
220,3xyXbtdQMlHYJa0ac6uf5B,La década trasnochada,2020-01-07,¡Final de temporada! Calu y Flor repasan lo mejor y lo peor del cine en la década 2010-2019 y eligen sus 15 películas favoritas de los últimos 10 años.,4841796,https://open.spotify.com/episode/3xyXbtdQMlHYJa0ac6uf5B
221,3zXSLyrHfUpvD0FcKe1krF,El top ten de 2019,2019-12-27,¡Episodio especial de Hoy Trasnoche! Fiorella Sargenti y Santiago Calori revelan sus películas favoritas de 2019.,3935556,https://open.spotify.com/episode/3zXSLyrHfUpvD0FcKe1krF
222,772fSqGyhgPmwfc74lEyuq,Qué suerte que mi mamá murió y no tiene que escuchar esto,2019-12-13,"THIS IS HOY TRASNOCHE. El único podcast de cine de POSTA PUNTO COM, con Santiago Calori y Fiorella Sargenti. Esta semana: Historia de un Matrimonio, de Noah Baumbach, y Entre Navajas y Secretos, de Rian Johnson. En el portarretratos, el director Umberto Lenzi. En los caprichos de Flor, Kramer vs. Kramer. Y en el videoclub de Calu, Raging Boll.",3362168,https://open.spotify.com/episode/772fSqGyhgPmwfc74lEyuq
223,2FQrV7H1bkA1IU6loY5XCH,La gente pide poronga seguido,2019-11-29,"Hoy Trasnoche es el “otro” podcast de cine, para los que saben que hay mucho más que las películas de la semana. En este episodio: un nuevo “Hoy Poronga”. Flor y el tío Calu ven y comentan en vivo “La casa en la playa”.",4757107,https://open.spotify.com/episode/2FQrV7H1bkA1IU6loY5XCH
224,1DVrVHn1U9OE2UMbCVvYMP,"Qué lindo que es el cine, la concha de mi madre",2019-11-22,"Hoy Trasnoche es ""el otro"" podcast de cine, para los que saben que hay mucho más que las películas de la semana. Conducen Santiago Calori y Fiorella Sargenti. Esta semana: El Irlandés. En el portarretratos: David Cronenberg. En los caprichos de Flor: el trueque entre De Niro y Pacino por El Padrino. Y en el videoclub de Calu: And soon the darkness (1970).",3618247,https://open.spotify.com/episode/1DVrVHn1U9OE2UMbCVvYMP
225,53CWQ9hGBLN04gpvjuKUme,Jorge Corona negro,2019-11-01,"Hoy Trasnoche es el ""otro"" podcast de cine, para los que saben que hay mucho más que las películas de la semana. Conducen Santiago Calori y Fiorella Sargenti. Esta semana: la nueva de Terminator, Dolemite Is My Name y blaxploitaition. En los caprichos de Flor: RIP Robert Evans. Y en el portarretratos: Herk Harvey.",3669499,https://open.spotify.com/episode/53CWQ9hGBLN04gpvjuKUme
226,6j1TkNXmVec8G7MU5KcwTL,Hoy Poronga Vol. 2,2019-10-25,"Esta semana en Hoy Trasnoche: un dildo de dos cabezas. Fiorella Sargenti y Santiago Calori presentan un nuevo especial de Hoy Poronga, dedicado a Zombieland: Tiro de Gracia y La Lavandería.",2345404,https://open.spotify.com/episode/6j1TkNXmVec8G7MU5KcwTL
227,0XcxOTrKEuqHVsHlLf0Zf8,Es tan cierto que es verdad,2019-10-18,"Hoy Trasnoche es el ""otro"" podcast de cine, para los que saben que hay mucho más que las películas de la semana. Conducen Santiago Calori y Fiorella Sargenti. Esta semana: Parasite, de Bong Joon-ho. Además: los 20 años de El Club de la Pelea. En los caprichos de Flor: Evita y Madonna en la Argentina. Y en el videoclub de Calo: Bloodline.",3492336,https://open.spotify.com/episode/0XcxOTrKEuqHVsHlLf0Zf8
228,28JwtuGN3Cs0BSaPpGmRJv,Antes del trasnochecer,2019-10-11,"Hoy Trasnoche es el ""otro"" podcast de cine, para los que saben que hay mucho más que las películas de la semana. Conducen Santiago Calori y Fiorella Sargenti. Esta semana: sigue el debate sobre EL BROMAS y se estrenaron Rambo: Last Blood y Monos, de Alejandro Landes. En los caprichos de Flor: la leyenda del Gramercy Hotel. En el videoclub de Calo: The Art of Self-Defense, de Riley Stearns.",3453205,https://open.spotify.com/episode/28JwtuGN3Cs0BSaPpGmRJv
229,5ZV1f3AJ1XnfRMckPlSbpY,Straight Outta Gotham,2019-10-04,"Hoy Trasnoche es el ""otro"" podcast de cine, para los que saben que hay mucho más que las películas de la semana. Conducen Santiago Calori y Fiorella Sargenti. Esta semana: Joker, de Todd Phillips... ¿les gustó o no les gustó? En el portarretratos: Sammo Hung. En los caprichos de Flor: la historia de River Phoenix. Y en el videoclub de Calu: Bliss, de Joe Begos. Este episodio de Hoy Trasnoche está presentado por Detrás de Bios, el nuevo podcast original de National Geographic que te lleva detrás de las cámaras y te muestra material inédito de su serie Bios: Vidas que Marcaron la Tuya. ¡Entrá a escucharlo!",3149218,https://open.spotify.com/episode/5ZV1f3AJ1XnfRMckPlSbpY
