,id,name,release_date,description,duration_ms,url
230,5yUu2DDyWAUguq9F9cWA2r,Al principio es rica pero después te mata,2019-09-27,"Hoy Trasnoche es el ""otro"" podcast de cine, para los que saben que hay mucho más que las películas de la semana. Conducen Santiago Calori y Fiorella Sargenti. Esta semana: Midsommar en los torrents y por qué llega tan tarde a los cines. En el portarretratos, la actriz Ajita Wilson. En los caprichos de Flor, por qué suena tanto Dies Irae en las películas. Y en el videoclub de Calo, The Wolf Hour.",3739873,https://open.spotify.com/episode/5yUu2DDyWAUguq9F9cWA2r
231,6dxeV15ztx2ziMeJmxDFSI,A dos toses,2019-09-20,"Hoy Trasnoche es el ""otro"" podcast de cine, para los que saben que hay mucho más que las películas de la semana. Conducen Santiago Calori y Fiorella Sargenti. En este episodio, y embriagados por el éxito de su presentación en vivo, hablan de Ad Astra e Iniciales S.G. En el portarretratos, el compositor italiano Alessandro Alessandroni. En los caprichos de Flor, la historia oscura de Mujer Bonita. En el videoclub de Calu, The Boat, de Winston Azzopardi.",2767935,https://open.spotify.com/episode/6dxeV15ztx2ziMeJmxDFSI
232,1iz7APXNe7WTjW5jjjTf5c,Especial de Navidad con Sebastián De Caro,2019-09-13,"Hoy Trasnoche es el ""otro"" podcast de cine, para los que saben que hay mucho más que las películas de la semana. Conducen Santiago Calori y Fiorella Sargenti. En este episodio, reciben la visita de Sebastián De Caro para hablar de su nueva película, Claudia, y de cómo está el cine en Argentina y el mundo.",4109505,https://open.spotify.com/episode/1iz7APXNe7WTjW5jjjTf5c
233,6ABSH5Nry7kGqOULQKUPQS,Muertos sin vida,2019-09-06,"Hoy Trasnoche es el ""otro"" podcast de cine, para los que saben que hay mucho más que las películas de la semana. Conducen Santiago Calori y Fiorella Sargenti. En este episodio: IT Capítulo 2, Los Payasos, Teen Spirit: Alcanzando tu Sueño y High Life. En el portarretratos: Kevin McClory. En los caprichos de Flor: Peter Bogdanovich. En el videoclub de Calu: Memory: The Origins of Alien.",2591634,https://open.spotify.com/episode/6ABSH5Nry7kGqOULQKUPQS
234,6RdUAZgXW7WKu8pOjtQPJa,No sé si nos va a entrar todo,2019-08-30,"Hoy Trasnoche es el ""otro"" podcast de cine, para los que saben que hay mucho más que las películas de la semana. Conducen Santiago Calori y Fiorella Sargenti. Esta semana: La Música de mi Vida y La Viuda. En el portarretratos (a.k.a. ""BIEN MUERTO ESTÁ""), John Lennon. En los caprichos de Flor, la historia de Mackenzie Phillips. Y en el videoclub de Calu, In Fabric.",3561012,https://open.spotify.com/episode/6RdUAZgXW7WKu8pOjtQPJa
235,02OwpvBJnK3ojdqUDoBsc5,Había una vez... PORONGA,2019-08-23,"Hoy Trasnoche es el ""otro"" podcast de cine, para los que saben que hay mucho más que las películas de la semana. Conducen Santiago Calori y Fiorella Sargenti. Esta semana: finalmente se estrena Había una vez... en Hollywood, la nueva película de Quentin Tarantino. ¿Maravilla u HOY PORONGA? En el portarretratos: John Cale. En los caprichos de Flor: el rancho de la Familia Manson. Y en el videoclub del tío Calu: Hail Satan?",3598002,https://open.spotify.com/episode/02OwpvBJnK3ojdqUDoBsc5
236,1AfU3IhlxiHYgCNWghDTN3,Presentamos... Dr. Muerte,2019-08-19,"Te invitamos a escuchar Dr. Muerte, un nuevo podcast basado en hechos reales que cuenta la investigación de los crímenes de Christopher Duntsch, un médico de Dallas que mutiló o asesinó a 33 pacientes en tan solo dos años. Un viaje al interior del sistema médico que no protegió a estos pacientes. En 6 episodios, vas a escuchar historias desgarradoras de pacientes que sobrevivieron y de los médicos que intentaron detenerlo. Suscribite ya a Dr. Muerte en http://wondery.fm/drmuerte.",607827,https://open.spotify.com/episode/1AfU3IhlxiHYgCNWghDTN3
237,03YsIW2DSItiEhJ268MWd9,Falopa mala mala falopa,2019-08-16,"Hoy Trasnoche es el ""otro"" podcast de cine, para los que saben que hay mucho más que las películas de la semana. Conducen Santiago Calori y Fiorella Sargenti. Esta semana: Booksmart, de Olivia Wilde. En el portarretratos: el director Jesús Franco. En los caprichos de Flor: ¿por qué Charles Manson cometió sus crímenes? Y en el videoclub de Calo: Brain Damage, de Frank Henenlotter.",2741394,https://open.spotify.com/episode/03YsIW2DSItiEhJ268MWd9
238,2ri9evXKwoJeKgsgKxXifh,Oggi a tarda notte,2019-08-02,"Hoy Trasnoche es el ""otro"" podcast de cine, para los que saben que hay mucho más que las películas de la semana. Conducen Santiago Calori y Fiorella Sargenti. Esta semana: Dogman, de Matteo Garrone. En el portarretratos: el director Sergio Garrone (no son parientes). Flor y Calu analizan la franquicia de Rápidos y Furiosos. Además: ¿Leonardo DiCaprio es la última gran estrella de Hollywood? Y en el videoclub: Il Sorpasso, de Dino Risi.",2299742,https://open.spotify.com/episode/2ri9evXKwoJeKgsgKxXifh
239,3vOliu3qIZ07nqkHJqdC6F,Ojalá se te muera un hijo en Navidad,2019-07-26,"Hoy Trasnoche es el ""otro"" podcast de cine, para los que saben que hay mucho más que las películas de la semana. Conducen Santiago Calori y Fiorella Sargenti. Esta semana: Infierno en la Tormenta, de Alexandre Aja. Además: La Mary, de Daniel Tinayre. En el portarretratos: la ex actriz de exploitation Christina Lindberg. En los caprichos de Flor: matrimonios lavanda en Hollywood. Y en el videoclub del Tío Calu: The Hole.",3132944,https://open.spotify.com/episode/3vOliu3qIZ07nqkHJqdC6F
240,76NuFvMxtolRrJgzsDIfQD,Rompieron mi infancia,2019-07-19,"Hoy Trasnoche es el ""otro"" podcast de cine, para los que saben que hay mucho más que las películas de la semana. Conducen Santiago Calori y Fiorella Sargenti. Esta semana: El Rey León y En los 90, el debut de Jonah Hill como director. En el portarretratos: el guionista Nicholas St. John. Además: cine indie noventoso, la historia del renacimiento de Disney, la vuelta de Edward Furlong y más.",3204310,https://open.spotify.com/episode/76NuFvMxtolRrJgzsDIfQD
241,2aKIeV0agnBS4NjGuPAE5U,Un kilo de berenjenas y un BB Sanzo,2019-07-12,"Hoy Trasnoche es el ""otro"" podcast de cine, para los que saben que hay mucho más que las películas de la semana. Conducen Santiago Calori y Fiorella Sargenti. ¡Comienza una nueva temporada! Calu y Flor juegan a Nicolás Repetto y repasan las películas que se estrenaron mientras no estuvieron. Y se meten con todo con el tremendo documental de los Parchís. En el portarretratos: Bob Rafelson. En los caprichos de Flor: qué pasó con Shelley Duvall. Y en el videoclub de Calu: Arrebato, de Iván Zulueta.",3502759,https://open.spotify.com/episode/2aKIeV0agnBS4NjGuPAE5U
242,27MtaBSX9xMyRbM3FwcOfN,Raining Blood: El musical,2019-05-31,"Hoy Trasnoche es el ""otro"" podcast de cine, para los que saben que hay mucho más que las películas de la semana. Conducen Santiago Calori y Fiorella Sargenti. En este episodio: Ma, Rocketman y Godzilla II: El Rey de los Monstruos. En el portarretratos: Paul Schrader. En los caprichos de Flor: ¿qué pasó con las mega archi ultra avant-premieres? Y en el videoclub de Calo: Tres Reyes.",3082136,https://open.spotify.com/episode/27MtaBSX9xMyRbM3FwcOfN
243,7v5gfrDwd6cczAOqiFuxFY,El bordado,2019-05-24,"Hoy Trasnoche es el ""otro"" podcast de cine, para los que saben que hay mucho más que las películas de la semana. Conducen Santiago Calori y Fiorella Sargenti. En este episodio: Extremandamente cruel, malvado y perverso, la nueva biopic del asesino serial Ted Bundy. Además: Aladdin, John Wick 3 y Brightburn. En el portarretratos: Tab Hunter. En los caprichos de Flor: guionistas, finales y expectativas. En el videoclub de Calu: Hagazussa.",3251513,https://open.spotify.com/episode/7v5gfrDwd6cczAOqiFuxFY
244,37bg9bB8ihPElAVsJ19DzP,10050 Cielo Drive,2019-05-17,"Hoy Trasnoche es el ""otro"" podcast de cine, para los que saben que hay mucho más que las películas de la semana. Conducen Santiago Calori y Fiorella Sargenti. En este episodio: El Cuento de las Comadrejas, de Juan José Campanella. En el portarretratos: Janet Leigh. En los caprichos de Flor: ¿Doris Day mató a Sharon Tate? Y en el videoclub de Calu: Sound of my Voice.",2309224,https://open.spotify.com/episode/37bg9bB8ihPElAVsJ19DzP
245,6AF8kCxuW3jCMvqRlX2gdS,Muere Marvel Muere,2019-05-10,"Hoy Trasnoche es el ""otro"" podcast de cine, para los que saben que hay mucho más que las películas de la semana. Conducen Santiago Calori y Fiorella Sargenti. En este episodio, reciben al creador del gran estreno argentino de la semana: Alejandro Fadel, guionista y director de Muere Monstruo Muere. En el portarretratos: Wes Craven y la historia de The Last House on the Left. En el videoclub, Calu recomienda I'll Take Your Dead. Y Flor nos cuenta todas las películas de Disney que vas a ver hasta que te mueras.",3625927,https://open.spotify.com/episode/6AF8kCxuW3jCMvqRlX2gdS
246,24fpCY3XuL6nLYFfnYHwHy,¡No puedo creer que no sea una venérea!,2019-05-03,"Hoy Trasnoche es el ""otro"" podcast de cine, para los que saben que hay mucho más que las películas de la semana. Conducen Santiago Calori y Fiorella Sargenti. En este episodio, más estrenos para ponerse al día, incluyendo El Hijo. En los caprichos de Flor: el debate por Avengers: Endgame. En el portarretratos: David E. Durston. Y en el videoclub de Calu: The House of the Devil, de Ti West.",3149270,https://open.spotify.com/episode/24fpCY3XuL6nLYFfnYHwHy
247,4suDLbiv2eCb4iYWsADnVp,"No es un bigote de Hitler, es caca",2019-04-19,"Hoy Trasnoche es el ""otro"" podcast de cine, para los que saben que hay mucho más que los estrenos de la semana. Conducen Santiago Calori y Fiorella Sargenti. En este episodio se ponen al día con 4x4, Vox Lux, Jamás Llegarán a Viejos y todo lo que se perdieron las últimas semanas. En el portarretratos: el cuarteto The Doll Family, ""los enanos de las películas"". En los caprichos de Flor: la historia de Los Diez Mandamientos, de Cecil B. DeMille. Y en el videoclub de Calu: Chungking Express, de Wong Kar-Wai.",2948153,https://open.spotify.com/episode/4suDLbiv2eCb4iYWsADnVp
248,36QlGbLnnkvltwbQ4vskLF,¿Y esta poronga?,2019-03-29,"Hoy Trasnoche es el ""otro"" podcast de cine, para los que saben que hay mucho más que los estrenos de la semana. Conducen Santiago Calori y Fiorella Sargenti. En este episodio: Dragged Across Concrete, de S. Craig Zahler, y The Dirt, la biopic de Motley Crue. En el portarretratos: Fred Olen Ray, director de Hollywood Chainsaw Hookers. En los caprichos de Flor: la vida de la actriz Jean Harlow y un nuevo capítulo del asunto Spielberg. Y en el videoclub del Tío Calu: My Name Is Julia Ross.",3693401,https://open.spotify.com/episode/36QlGbLnnkvltwbQ4vskLF
249,5CTlxeXpiEgwq3edOv2dKf,A veces la tía Marta hace cosas horrorosas,2019-03-22,"Hoy Trasnoche es el ""otro"" podcast de cine, para los que saben que hay mucho más que los estrenos de la semana. Conducen Santiago Calori y Fiorella Sargenti. En este episodio: Nosotros, la nueva película de Jordan Peele. En el portarretratos: el misterioso actor Abe Zwick y su único papel. En el videoclub: The Woman in the Window. Y Calu y Flor debaten la compra de Fox por Disney.",2805657,https://open.spotify.com/episode/5CTlxeXpiEgwq3edOv2dKf
250,0UCbmETnuNtuwWzVelnf0p,Hoy Trastorrent,2019-03-15,"Hoy Trasnoche es el ""otro"" podcast de cine, para los que saben que hay mucho más que los estrenos de la semana. Conducen Santiago Calori y Fiorella Sargenti. En este episodio: Border, Leaving Neverland y Lords of Chaos. En el portarretratos: James Isaac, el protegido de David Cronenberg que terminó dirigiendo Jason X. En el videoclub: Until the Light Takes Us. Además, Calu y Flor discuten el asunto de Steven Spielberg vs. Netflix.",4393980,https://open.spotify.com/episode/0UCbmETnuNtuwWzVelnf0p
251,5tKTehrD2lzI5OhhcFPV19,El prode de los Oscar (sale mal),2019-02-22,"Hoy Trasnoche es el ""otro"" podcast de cine, para los que saben que hay mucho más que los estrenos de la semana. Conducen Santiago Calori y Fiorella Sargenti. En este episodio: CALU Y FLOR JUEGAN AL PRODE DE LOS OSCAR 2019.",2658691,https://open.spotify.com/episode/5tKTehrD2lzI5OhhcFPV19
252,6rcDirgCFSa8viz41bUsez,Jugo cadavérico,2019-02-15,"Hoy Trasnoche es el ""otro"" podcast de cine, para los que saben que hay mucho más que los estrenos de la semana. Conducen Santiago Calori y Fiorella Sargenti. En este episodio: Green Book. En el portarretratos: Michael Cimino, director de una de las mejores y una de las peores películas de la historia. En los caprichos de Flor: cómo se disputan las nominaciones por actuación en los Oscar. Y en el videoclub del tío Calu: El Extraño Vicio de la Señora Wardh.",2372061,https://open.spotify.com/episode/6rcDirgCFSa8viz41bUsez
253,6mmkx0ozRLJtYuJaKzobN2,Ese premio se hizo caca,2019-02-09,"Hoy Trasnoche es el ""otro"" podcast de cine, para los que saben que hay mucho más que los estrenos de la semana. Conducen Santiago Calori y Fiorella Sargenti. En este episodio: La Favorita, de Yorgos Lanthimos. En el portarretratos: la misteriosa muerte de Estelita Rodríguez. En los caprichos de Flor: papelones históricos de los premios Oscar. Y en el videoclub del tío Calu: You Might Be the Killer.",2763054,https://open.spotify.com/episode/6mmkx0ozRLJtYuJaKzobN2
254,2MkuT6IuG4wYMIeUdhGpJT,Espiritismo,2019-02-01,"¡Nueva temporada de Hoy Trasnoche! El ""otro"" podcast de cine, para los que saben que hay mucho más que los estrenos de la semana. Conducen Santiago Calori y Fiorella Sargenti. En este episodio: la vieja Suspiria de Dario Argento vs. la nueva Suspiria de Luca Guadagnino. En el portarretratos: Eadweard Muybridge, ¿el inventor del cine? En el videoclub de Calu: The Clovehitch Killer. Y en los caprichos de Flor: ¿por qué Pantera Negra está nominada al Oscar a Mejor Película?",3089253,https://open.spotify.com/episode/2MkuT6IuG4wYMIeUdhGpJT
255,2lNUMo4JXaGqw3P320BsF5,"El cumple de Flor, bis",2018-12-21,Hoy Trasnoche no es otro podcast de cine. Es “el otro” podcast de cine. Para los que saben que hay mucho más que los estrenos de la semana. Conducen Santiago Calori y Fiorella Sargenti. ¡Último episodio del año! Calo y Flor completan el repaso por sus favoritos de 2018 con las películas que no salieron en cines y se consiguen por streaming legal o empujados a la delincuencia.,3080490,https://open.spotify.com/episode/2lNUMo4JXaGqw3P320BsF5
256,2Qkn1hpdWW2CIT94V9V3Wv,El cumple de Calo,2018-12-14,"Hoy Trasnoche no es otro podcast de cine. Es “el otro” podcast de cine. Para los que saben que hay mucho más que los estrenos de la semana. Conducen Santiago Calori y Fiorella Sargenti. ¡Anteúltimo episodio del año! Calu y Flor presentan sus top 10 de películas estrenadas comercialmente en cines durante 2018. La semana que viene, las que salieron por streaming y otras vías.",3219749,https://open.spotify.com/episode/2Qkn1hpdWW2CIT94V9V3Wv
257,0jLurQFEUrAnb6RPKeCIv6,La luna no es una estrella,2018-11-30,"Hoy Trasnoche no es otro podcast de cine. Es ""el otro"" podcast de cine. Para los que saben que hay mucho más que los estrenos de la semana. Conducen Santiago Calori y Fiorella Sargenti. Esta semana vieron El Primer Hombre en la Luna, de Damien Chazelle. En el portarretratos, el cineasta Lucio Fulci, director de Zombi y Zombi 2\. En los caprichos de Flor, 25 años de Philadelphia. Y en el videoclub de Calu, Henry: Retrato de un Asesino, de John McNaughton.",2449920,https://open.spotify.com/episode/0jLurQFEUrAnb6RPKeCIv6
258,07YTqPPqkNeXy6x5cLjO6k,Por vía alternativa,2018-11-23,"Hoy Trasnoche no es otro podcast de cine. Es ""el otro"" podcast de cine. Para los que saben que hay mucho más que los estrenos de la semana. Conducen Santiago Calori y Fiorella Sargenti. Esta semana vieron The Other Side of the Wind, la película perdida de Orson Welles, y La Balada de Buster Scruggs, de los hermanos Coen. En el portarretratos: Abraham Zapruder, el aficionado que filmó el asesinato de JFK. En los caprichos de Flor: accidente y decapitación en el set de La Dimensión Desconocida. Y en el videoclub de Calu: Yo no sé qué me han hecho tus ojos, de Lorena Muñoz y Sergio Wolf.",3253917,https://open.spotify.com/episode/07YTqPPqkNeXy6x5cLjO6k
259,0qy6QAU8ImubH2Y5yiISSv,Nazis malos,2018-11-16,"Hoy Trasnoche no es otro podcast de cine. Es ""el otro"" podcast de cine. Para los que saben que hay mucho más que los estrenos de la semana. Conducen Santiago Calori y Fiorella Sargenti. Esta semana: El Infiltrado del KKKlan, de Spike Lee. En el portarretratos: la actriz y cantante Soledad Miranda. En los caprichos de Flor: la maldición de Rebelde sin Causa. Y en el videoclub de Calu: Skate Kitchen, de Crystal Moselle.",2862811,https://open.spotify.com/episode/0qy6QAU8ImubH2Y5yiISSv
260,3cNHKhT0JZzIThiHopE9mB,Hoy Bulsara,2018-11-02,"¡El crossover podcastero más ambicioso de la historia! Santiago Calori y Fiorella Sargenti de Hoy Trasnoche se juntaron con BB Sanzo y Alexis Valido de Puerto Bulsara, el único podcast de Queen del mundo (?), para tirarse de todo por el estreno de Bohemian Rhapsody... y no podrás creer lo que pasó a continuación.",4577750,https://open.spotify.com/episode/3cNHKhT0JZzIThiHopE9mB
261,1GaiLH1tE5X0Aisx4g0tpT,Halloween,2018-10-26,"Hoy Trasnoche no es otro podcast de cine. Es ""el otro"" podcast de cine. Para los que saben que hay mucho más que los estrenos de la semana. Conducen Santiago Calori y Fiorella Sargenti. Esta semana vieron la nueva Halloween, de David Gordon Green, y de paso recorren la tumultuosa historia de la franquicia slasher. En el videoclub de Calu: An Evening with Beverly Luff Linn, de Jim Hosking. ¡Y enterate en qué puesto del ranking de fueguinos está Flor esta semana!",3020983,https://open.spotify.com/episode/1GaiLH1tE5X0Aisx4g0tpT
262,3hdQF2NX90av7XCm6YSRDA,29: Casi Bruce Lee,2018-10-19,"Hoy Trasnoche no es otro podcast de cine. Es ""el otro"" podcast de cine. Para los que saben que hay mucho más que los estrenos de la semana. Conducen Santiago Calori y Fiorella Sargenti. Esta semana vieron Hold the Line, de Jeremy Saulnier, y Sorry to Bother You, de Boots Riley. En los caprichos de Flor: las hermanas Joan Fontaine y Olivia de Havilland. En el videoclub de Calu: The Thin Blue Line, de Errol Morris. ¡Y te invitamos a la avant premiere de Halloween!",3179233,https://open.spotify.com/episode/3hdQF2NX90av7XCm6YSRDA
263,5P5yUy6ojLt2nGYgthwpCX,28: Pequeño pero mayor,2018-10-12,"Hoy Trasnoche no es otro podcast de cine. Es ""el otro"" podcast de cine. Para los que saben que hay mucho más que los estrenos de la semana. Conducen Santiago Calori y Fiorella Sargenti. Esta vez fueron a ver Nace una Estrella y El Potro. En el portarretratos: William H. Marshall, protagonista de Blacula, ""el Drácula Negro"". Y en el videoclub de Calu: Santoalla, de Andrew Becker y Daniel Mehrer.",2732173,https://open.spotify.com/episode/5P5yUy6ojLt2nGYgthwpCX
264,5f1RVNVI3FErIR67R77f2P,"27: John y Nico, Nico y John",2018-09-28,"Hoy Trasnoche no es otro podcast de cine. Es ""el otro"" podcast de cine. Para los que saben que hay mucho más que los estrenos de la semana. Conducen Santiago Calori y Fiorella Sargenti. La película de la semana es Mandy, de Panos Cosmatos: para Calu y Flor, en el top 5 del año. En el portarretratos: Laura Gemser, la ""Emanuelle negra"". Flor nos cuenta sobre la dinastía Coppola: Francis Ford, Sofia, Carmine, Italia, Roman, Nicolas Cage y compañía. Y en el videoclub de Calu: Brexitannia, de Timothy George Kelly.",2511020,https://open.spotify.com/episode/5f1RVNVI3FErIR67R77f2P
265,144hnTv7vi6M6gNks179e4,26: Tradi,2018-09-21,"Hoy Trasnoche no es otro podcast de cine. Es ""el otro"" podcast de cine. Para los que saben que hay mucho más que los estrenos de la semana. Conducen Santiago Calori y Fiorella Sargenti. Esta semana hablan de Soledad, de Agustina Macri, y otras películas que llegaron a la cartelera. En el portarretratos: el guionista John Alan Schwartz, director (con seudónimo) de Los Rostros de la Muerte 1, 2, 3, 4, 5, 6 y 7\. En los caprichos de Flor: los mitos del Hotel Roosevelt. Y en el videoclub del Tío Calu: What Keeps You Alive, de Colin Minihan.",2404232,https://open.spotify.com/episode/144hnTv7vi6M6gNks179e4
266,43hl3SlEwvqWjrQiN81InA,25: Ayer Trasnoche: 1984,2018-09-14,"Hoy Trasnoche no es otro podcast de cine. Es ""el otro"" podcast de cine. Para los que saben que hay mucho más que los estrenos de la semana. Conducen Santiago Calori y Fiorella Sargenti. Esta semana vieron Summer of '84, de RKSS, y viajan al verano de 1984 para ver qué la rompía en los cines en esa época (spoilers: Ghostbusters, Gremlins, Karate Kid, Top Secret!). En el portarretratos: Y.K. Kim, el artista marcial coreano protagonista de Miami Connection. En el videoclub de Calu, Sicario 2: Soldado. ¡Y Flor trajo una sección! Nos cuenta sobre Jon Peters, ""el Donald Trump de Hollywood"".",3190047,https://open.spotify.com/episode/43hl3SlEwvqWjrQiN81InA
267,1eeD4GHi1f1RG246YSMQgz,Monjas chanchitas,2018-09-07,"Hoy Trasnoche no es otro podcast de cine. Es ""el otro"" podcast de cine. Para los que saben que hay mucho más que los estrenos de la semana. Conducen Santiago Calori y Fiorella Sargenti. Esta semana hablan de Todos lo saben, de Asghar Farhadi, y La Monja, la nueva entrega de la franquicia de El Conjuro. De paso, se meten en el mundo del horror religioso y otras monjas que dan miedo. En el portarretratos: el actor argentino Romualdo Quiroga. Y en el videoclub, Piazzolla: Los Años del Tiburón, de Daniel Rosenfeld. **Este episodio de Hoy Trasnoche está presentado por Cinemark y Hoyts. Si escuchás Hoy Trasnoche, te gusta el cine. Y si te gusta el cine, vas a Cinemark y Hoyts. **",2784079,https://open.spotify.com/episode/1eeD4GHi1f1RG246YSMQgz
268,6FOlV3UCKDOobMcLqnBEdn,24: El capítulo videoclub (Vol. 2),2018-08-24,"Hoy Trasnoche no es otro podcast de cine. Es ""el otro"" podcast de cine. Para los que saben que hay mucho más que los estrenos de la semana. Conducen Santiago Calori y Fiorella Sargenti. En el portarretratos de esta semana: Jack Nicholson, en su faceta de guionista. Hablamos de algunos estrenos (El Justiciero 2, Quién Mató a los Puppets, Latidos en la Oscuridad), pero las estrellas de este episodio son las películas del videoclub: The Tale, Beast, Puppet Master: The Littlest Reich, Upgrade, A todos los chicos de los que me enamoré, Heavy Trip, The Death of Stalin y Unsane. Y, por supuesto, el trailer de Suspiria de Luca Guadagnino. **Este episodio de Hoy Trasnoche está presentado por Cinemark y Hoyts. Si escuchás Hoy Trasnoche, te gusta el cine. Y si te gusta el cine, vas a Cinemark y Hoyts. **",3641052,https://open.spotify.com/episode/6FOlV3UCKDOobMcLqnBEdn
269,4943HtX54TYEuyt3giNI4P,23: Prejuzgando gente en una plaza,2018-08-17,"Hoy Trasnoche no es otro podcast de cine. Es ""el otro"" podcast de cine. Para los que saben que hay mucho más que los estrenos de la semana. Conducen Santiago Calori y Fiorella Sargenti. En el portarretratos de esta semana: Frank Henenlotter, director de Basket Case, Brain Damage y Frankenhooker. Se estrenó Una Obra Maestra, de Gastón Duprat, y nos preguntamos: ¿esta sí tiene director de fotografía? Además: Megalodón y qué hace buena a una mala película. Y en el videoclub de Calu: American Animals, de Bart Layton. Flor, otra vez, se olvidó de preparar su sección. Este episodio de Hoy Trasnoche está presentado por Cinemark y Hoyts. Si escuchás Hoy Trasnoche, te gusta el cine. Y si te gusta el cine, vas a Cinemark y Hoyts.",3043057,https://open.spotify.com/episode/4943HtX54TYEuyt3giNI4P
270,4ZJYpWOrkgTF2lxx9Nv5oI,22: Nenucos para empalar,2018-08-10,"Hoy Trasnoche no es otro podcast de cine. Es ""el otro"" podcast de cine. Para los que saben que hay mucho más que los estrenos de la semana. Conducen Santiago Calori y Fiorella Sargenti. En este episodio: El Angel, de Luis Ortega... ¿es para tanto? En el portarretratos: la actriz japonesa Tura Luna Pascual Yamaguchi, mejor conocida como Tura Satana. ¡Estrenamos sección! En los giallos de Calo: Autostop Rosso Sangue. Hacemos el top 10 de películas con bebés asesinos y le explicamos El Bebé de Rosemary a Amalia Granata. **Este episodio de Hoy Trasnoche está presentado por Cinemark y Hoyts. Si escuchás Hoy Trasnoche, te gusta el cine. Y si te gusta el cine, vas a Cinemark y Hoyts. **",3110349,https://open.spotify.com/episode/4ZJYpWOrkgTF2lxx9Nv5oI
271,6LhaZS0mxQBwzXizBOF8D1,21: Usted decide,2018-08-03,"Hoy Trasnoche no es otro podcast de cine. Es ""el otro"" podcast de cine. Para los que saben que hay mucho más que los estrenos de la semana. Conducen Santiago Calori y Fiorella Sargenti. En la cartelera: Disobedience, de Sebastián Lelio. En el portarretratos: las actrices siamesas Daisy y Violet Hilton. En el conchódromo de Flor: Lana Turner y su tumultuosa relación con un gángster. Y en el videoclub de Calu: The Devil and Father Amorth, de William Friedkin. Este episodio de Hoy Trasnoche está presentado por Cinemark y Hoyts. Si escuchás Hoy Trasnoche, te gusta el cine. Y si te gusta el cine, vas a Cinemark y Hoyts.",2677918,https://open.spotify.com/episode/6LhaZS0mxQBwzXizBOF8D1
272,1JTvuDVt3S9p3C4LElrW3x,20: Hoy Poronga,2018-07-20,Hoy Poronga no es sólo un podcast de cine: es el podcast de cine dedicado a hablar de las peores películas jamás estrenadas. Conducen Santiago Calori y Fiorella Sargenti. La abominación de esta semana... Bañeros 5: Lentos y Cargosos. Este episodio está presentado por Cinemark y Hoyts.,3191511,https://open.spotify.com/episode/1JTvuDVt3S9p3C4LElrW3x
